<?xml version="1.0" encoding="UTF-8" standalone="no"?>
<xs:schema xmlns:xs="http://www.w3.org/2001/XMLSchema">
    <xs:element name="libreria">
        <xs:complexType>
            <xs:sequence>
                <xs:element ref="libro" minOccurs="1" maxOccurs="unbounded"></xs:element>
            </xs:sequence>
        </xs:complexType>
    </xs:element>
    <xs:element name="libro">
        <xs:complexType>
            <xs:sequence>
                <xs:element name="nombre" type="xs:string"></xs:element>
                <xs:element name="autor" type="xs:string"></xs:element>
                <xs:element name="editorial" type="xs:string"></xs:element>
                <xs:element name="genero" type="xs:string"></xs:element>
                <xs:element name="fecha" type="xs:date"></xs:element>
                <xs:element name="valoracion" type="xs:unsignedInt" ></xs:element>
                <xs:element name="comentario" type="xs:string" minOccurs="0" maxOccurs="3" ></xs:element>
            </xs:sequence>
        </xs:complexType>
    </xs:element>
   
</xs:schema>